foto,modello,prezzo
cuscinetti bronsor1.jpg, G3-Cuscinetto a sfera-orange-silver,prezzo: € 39.99
cuscinetti bronsor2.jpg, G2-Cuscinetto a sfera-orange-silver,prezzo: € 24.99
cuscinetti bronsor3.jpg, Ceramic-Cuscinetto a sfera-black-orange,prezzo: € 89.99
cuscinetti bronsor4.jpg,RAW-Cuscinetto a sfera grey-orange,prezzo: € 54.99
cuscinetti bronsor5.jpg,Mason Silva Pro Bearing G3-Cuscinetto a sfera-white-black,prezzo: € 39.99
cuscinetti bronsor6.jpg, High Speed Ceramic Oil 15ml-Cuscinetto a sfera-no color,prezzo: € 12.99
cuscinetti bronsor7.jpg, David Gravette Pro Bearing G3-Cuscinetto a sfera orange-silver,prezzo: € 39.99
cuscinetti bronsor8.jpg, Aaron JAWS Homoki Pro Bearing G3-Cuscinetto a sfera-tie-dye,prezzo: € 39.99